{
  "$schema": "https://json-schema.org/draft/2020-12/schema",
  "$id": "https://agentic-qa-swarm.example/contracts/events/v1/run.confirmed.schema.json",
  "title": "Evento run.confirmed",
  "type": "object",
  "properties": {
    "event_id": {
      "type": "string",
      "format": "uuid"
    },
    "type": {
      "enum": [
        "run.confirmed"
      ]
    },
    "version": {
      "const": 1
    },
    "occurred_at": {
      "type": "string",
      "format": "date-time"
    },
    "trace_id": {
      "type": "string",
      "minLength": 1
    },
    "data": {
      "type": "object",
      "properties": {
        "run_id": {
          "type": "string",
          "minLength": 1
        },
        "notification_id": {
          "type": "string",
          "minLength": 1
        },
        "confirmed_by": {
          "type": "string",
          "minLength": 1
        },
        "flows": {
          "type": "array",
          "items": {
            "type": "string",
            "minLength": 1
          },
          "minItems": 1
        },
        "artifact": {
          "type": "object",
          "description": "Artefacto de la notificación confirmada (opcional: eventos anteriores no lo traen; el controlador usa su respaldo).",
          "properties": {
            "kind": {
              "enum": [
                "build-from-repo",
                "published-image"
              ]
            },
            "ref": {
              "type": "string",
              "minLength": 1
            }
          },
          "required": [
            "kind",
            "ref"
          ],
          "additionalProperties": false
        },
        "warm": {
          "type": "object",
          "description": "Destino del entorno warm para la corrida (opcional; si se omite, el controlador usa aqs-test).",
          "properties": {
            "warm_id": {
              "type": "string",
              "minLength": 1
            },
            "namespace": {
              "type": "string",
              "minLength": 1
            }
          },
          "required": [
            "warm_id",
            "namespace"
          ],
          "additionalProperties": false
        }
      },
      "required": [
        "run_id",
        "notification_id",
        "confirmed_by",
        "flows"
      ],
      "additionalProperties": false
    }
  },
  "required": [
    "event_id",
    "type",
    "version",
    "occurred_at",
    "trace_id",
    "data"
  ],
  "additionalProperties": false
}
